type,posts
ENFP,"'So...if this thread already exists someplace else (which it does:  http://personalitycafe.com/enfp-forum-inspirers/116902-movies-loved-enfp.html#post2952851), how the heck to I delete this one here???|||Ooops...I guess I didn't look too hard because I just started a Movies every ENFP should watch thread...|||So, this came up in the You Know You're An ENFP When... thread.  (@Pucca :  here we go!  IT IS DONE :D) This isn't a list of films with ENFPs IN them, but rather ones that you believe ENFPs would...|||I know that I liked UP. :D|||I choose feeding myself joy over beating myself up.”  --Buddy Wakefield|||[QUOTE=Pucca;2951774]I've never seen it.:shocked:QUOTE]  Me, neither.   Guess we should have a Movie Marathon of All Movies ENFPs Should Watch. :D|||That's hilarious. hahaha I used to pretend I had a bunch of dragon friends and a whole bunch of animals (like platypi and octopi and ocelots, and horses, etc.) I was always rescuing my dragons from...|||WOOO!  I'd love to be the TARDIS! :D|||This is from my signature (actually, just look at all the quotes in my signature)  I am a forest, and a night of dark trees: but he who is not afraid of my darkness, will find banks full of roses...|||I'm not quite that bad either (and counting sheep doesn't work for me because I get distracted and numbers are not my strong point).  It does take me a long time to fall asleep even when I'm tired. ...|||Rune: That is an awesome photo/e-card.  I love it!  It is so true! :D|||I'm an ENFP (and a 4w5).  I'm conflicted on the subject. :3  I like to say This Is Me, but at the same time, I don't want to be put in a box, or have a label or stereotype applied to me.  I like...|||I like how people can discuss things when they don't agree.  This begins to seem like people arguing rather than discussing and some of the comments are a bit mean-spirited and undiplomatic (No...|||Because I don't like editing--it's my least favorite part of the writing process, I sort of edited while I went.  Kind of.  And then read through it once to make sure everything made sense and there...|||Hey there! :D  Welcome and enjoy the forums!!! :D|||So I already posted about my conversation style and merely touched upon editing my writing without going into it.  This is going to be the third time/thread I've posted this, but here we go: I love...|||Yeah, I'd say my conversation/speaking style is meandering as well! :D hahaha I love writing and took a lot of English classes (I eventually decided that I wanted to be an English teacher and so I...|||I was thinking of being an English teacher for a while and so I have had many writing classes.  I think @ChanceyRose is correct about people's writing styles depending upon the teacher.  One of my...|||I think I (an ENFP) tend to just keep going when I'm trying to get a point across that I know I'm not verbalizing well.  (When I'm speaking....if it's an essay or something, then I edit and...|||Usually, I stick to one book at a time (not including what I used to have to read for school), but lately I've been reading several books at once.  Currently, I'm re-reading Tolkien's THE HOBBIT. ...|||Dear Anonymous(es)  Clearly you did not recieve my last letter.  Or you did not understand it.  I assume this because it has been a week and NO ONE HAS HIRED ME OR EVEN CALLED ME BACK.  Look, I...|||I don't think I was being sarcastic...sometimes it happens when I didn't intend it though. :)  Hufflepuff is from Harry Potter.  It's one of the four dormitories houses in the castle.  Each...|||agreeeeeeeed!!!!!! :d|||Fluffy can be strong, too.  :3  I know what you mean though.  We're champions and we inspire people.  But why can't we be silly and fun-loving and affectionate as well?  I'm not saying every ENFP...|||I also found it interesting, but what about if you are on a medication that changes the chemicals/hormones in your brain?  Wouldn't that mean that your personality would change as well (according to...|||I realize that being nice and being fair are not mutually exclusive.  I would hope that people try to be both!  However, someone posed the question to me where you HAD to pick one and I was curious...|||--Sincerity/being genuine/honesty:  don't try to be someone you're not because you think I'll like you better.  I'd much rather see/hear the real you.  I like differences in people and so I'd want to...|||Just because you're not the only one, doesn't mean you're not crazy. :P  You're just crazy in good company! :D <3|||No problem, darlin. :D  I love meeting/welcoming new people!|||Welcome and have fun posting!! :D I am also an ENFP.|||I've never been professionally diagnosed but I've had many people ask me if I have it.  *shrug*  I think it's because like so many ENFPs, I go off on tangents when I tell stories or explain something...|||Is it better to be Fair or to be Nice? Explain and discuss your answers. :D  Have fun!|||Is it better to be Fair or to be Nice?  Explain and discuss your responses. :D  Have fun!|||ENFP Hufflepuff! :D   And proud of both!   And I think people stereotype too much with this.  I think any type can be in any house.  There is value in every house! :D|||I hate shopping!  Unless it's at a bookstore, Renaissance Faire, or a Sci-Fi con dealer's room.  I get bored and frusterated when I'm shopping for clothes, shoes, or anything else because it's...|||Okay, I agree with the every-and-none personality type. Or borderline on everything...  But I thought it would be fun to type him/her/any-variation-there-upon if he/she exists (or existed or...|||Yeah, I'm thinking you're going to have to do some heavy lifting hahaha.  On the other hand, the reading might interest you and then it won't seem so heavy.   Also, we're more than just lables...|||Oh, wow!  Because I was totally guessing... couldn't tell you exactly WHY I thought that based on your reading.  :3  I mean, I couldn't cite specific instances (except for the two that I pointed out...|||Words: You are amazing/awesome/fascinating. I love how/when you ___. I love you. You're so interesting. You're inspirational You have such good ideas. You're an excellent writer....|||I LOVE the teddy bear metaphor!  Great analogy!  I'm stealing it. ;P|||Bienvenue!  :D  Have fun in the forums and good luck figuring out yourself and your direction/desires!|||A friend--or two--in my area (I recently moved halfway across the country).  And a fulfilling job.|||Okay...this is just a guess, but maybe ENTP?  I don't know enough about the cognitive functions to back it up that way, but here's the reasonign behind my guess: N because you talked about how you...|||I'm not very good with functions and picking out which function I'm using at which time. So do you think you could say which things were Ne in my responses?  Maybe then I can learn to pick up other...|||I knit or do some other craft (as long as the craft is simple and doesn't have a complicated pattern).  Or I'll listen to one while driving or doing chores that are physical only with no need for...|||I found this thread:  http://personalitycafe.com/whats-my-personality-type/99679-whats-my-type-questionnaire.html and decided to give it a go.  Here are my responses.  I'd be interested in hearing...|||[QUOTE=Kevinaswell;400994]When I say green and grape soda and you say huh?QUOTE]  Okay, I'm an N and I didn't get the reference or whatever, but instead of going huh I immediatly was...|||That's true...sort of! hahah, it goes in cycles for me.  Spurts of interest. :D|||Dear Anonymous(es),  You should hire me.  I'd be a great asset.  It IS possible to be fun-loving/lightheatrted AND professional.  And trust me, I am NOT over/underqualified.  I'm sorry you found my...|||My lovelife is nonexistant.   Recently (basically since I went on Vacation with my parents last week and non of my siblings could make it), I began thinking about how nice it would be to have somone...'"
INTP,"'So many questions when i do these things.  I would take the purple pill. Pick winning lottery numbers. Do whatever I want.|||I worked in a brewery for a couple years here. I dont know if you're familiar with the local micros/craft at all but Mill st. was the name of it. Their tankhouse is my favorite of anything local.|||I am going to summon the great and powerful mr cafebot and his song of destruction. The four horseman ride. Count your days people of earth.   Intro: Nick - the INTP male - from a basement...|||This thread is obviously about the textbook definition of manliness. Ruffin it, tuffin it, and going hard in the mother fking paint.|||Stand up for yourself. You asked for the time off and it was approved. When they say, oh shit we are short staffed, where is Badgers? They figure out you asked for it off, that's why you arn't there....|||Lol excellent thread @NT the DC. I love watching baseball, and playing it. Oh and I hate the yankees. I'm 19, I've had multiple partners, I consider myself a manly man, I lift, and I am intp.   No...|||The thing with relationships is that you spend very little time in the bedroom compared to everything else. So while a dumb blonde can make you happy for 20 minutes a night, its going to take more...|||Thinking: A man plants a fruit tree because it will give him food in a few years. Feeling: A few years later a squirrel is hungry so it eats the fruit from the tree. Intuitive: The man sees his...|||Well I think you can appreciate an Einstein quote.. Everyone is a genius, but if you judge a fish on it's abiility to climb a tree it will live it's whole life believing it is stupid.  Everybody...|||Vsauce|||Real men write poetry.|||19, 6'4|||Oh and: Mountain dew releases mountain flavored Doritos locos tacos skateboards. That is all.  Also  http://www.youtube.com/watch?v=VP9--tH_YRo&amp;feature=youtu.be check this out. (still...|||There's only two things I am certain of with Rusell Brand.  1. He is very heavilly extraverted. 2. He is a magical man.|||Here I am people.   https://www.youtube.com/watch?v=rKVJARVcuhc|||badgers  I'm gonna make a male version intp video today.|||The creative process of intps is getting around to doing the thing and not putting it off. I think we're always ready for work provided we have sleep, and food in our stomachs.|||I may look busy, but I hear everything.|||I'm a guy but I like making videos. I'd love to be a part of this.|||Hey man, it's your life. Do or do not, there is no try.|||Yes. You know you're an intp when you have more conversations in your head than you do with real people.|||tl;dr   Yes I posted this.|||spoken like a true intp.|||If you really are bothered (and I believe you are), I think you should tell your boyfriend what you just said there.|||Morality invariably gets me talking, because it has philosophy but with tangable answers.  Other good subjects include evolution, hunter gatherer societies, political systems, good movies,...|||Hey b3th. I read your post and my immediate reaction was that your boyfriend is flipping out over something insignificant. Having trust issues is nothing to wag a finger at, but I think your idea of...|||I enjoy 9/10 of DarkBarlow 's posts. So a crush, ya maybe.|||In self defense, but then it's not really a crime.  Would you kill somebody to save 1000 people? For millions of dollars?|||“Thirty years later he could not come to any other conclusion: women  were indisputably better than men. They were gentler, more affectionate,  more loving and more compassionate, they were rarely...|||We really should make a clear-cut method of differentiating the two. Intp are lazy and useless. They do things for no reason, often with disastrous results. The basically lack the things that make...|||743177431874319|||>2013 >Not using adblocker  Ps: ask an analytical type they will tell you they want to see less advertising, not help you do it better.|||Hahahaha this.|||73701 This is now a mango thread.|||+ Chameleon skills. That thing where we can mirror the mood/personality of others.  - Chameleon skills. Makes me wonder if I'm being true to myself.|||Free for all.|||We wouldn't be human without either of them.|||Well I know 100% sure you are wrong, because I exist. But obviously I can't prove it.|||73121|||The problem is in the first word of your post, Watching the news. TV news is entertainment, not journalism.|||I resent the thought that humans are nothing but selfish creatures, when being selfless can be accomplished on a whim. Fulfillment in life often comes in the form of giving to others. And Solfonny,...|||yup basically this. lol.|||Suicide is a permanent solution to non-permanent problems.   Selfish?  -It will cause pain and burden to your family for the rest of their lives, so not thinking of them could be considered...|||Lol you're a women. That was easy.|||Seriously, a day where every intp is on adderal? We would live in utopia by noon.|||Repeat the mantra: I am self aware.|||So you reject ideas that don't come from gods?  Camus declares that humans are here, we exist, there is nothing that can change that. Now we have a choice.  1. Get pissed off, give up, or revolt,...|||What, in fact, is the Absurd Man? He who, without negating it, does nothing for the eternal. Not that nostalgia is foreign to him. But he prefers his courage and  his reasoning. The first teaches him...|||So they don't need to elbow past people in a hurry and potentially miss the train door closing. Otherwise, they want to be first off the train/bus and not get stuck behind a crowd of slow walkers. ...|||This is a loaded question.   As for me I'm 19 and still strongly believing in non-belief.      INTERNET POLICE:   RESTRAIN FROM TROLLING AT ONCE! INTP:                    I...I...CAN'T...'"
INFP,"'I am very conflicted right now when it comes to wanting children.  I honestly had no maternal instinct whatsoever until recently.  Up until now, none of my close friends have had children, and I...|||If I had to guess for my closest friends:  1. ISFJ 2. ESFP 3. ISTJ 4. xNFP 5. ESFJ  I don't know if this is correct or not because I don't know if *they* know their types (actually the xNFP...|||What you said in the last paragraph ... as a teacher, this frustrates me too!  There's a trend in education to combine classes more and more to contain a variety of types of students (which I won't...|||I can't say that I had much trouble with my community in general.  I mean, if I'm talking about my same-age peers, I was never considered popular because I was too into artsy extracurricular...|||I do eat meat, and I do feel guilty about it.  I have vaguely considered not eating meat, but I don't think I could actually do it because of my nutritional requirements.  I need a high protein diet...|||Well I am in the SAME boat as you except I teach science, not theater (I know most people don't think of science as INFP but I find it interesting, and I'm good at it).  I had another career that I...|||Exactly if God truly created one man and one woman, and he technically created the woman from the man, then we're all products of incest.|||As per the 10 books that have stayed with you list going around Facebook, my choices are the following (in no special order):   The Reader by Bernhard Schlink   Interpreter of Maladies by Jhumpa...|||These are some amazing lists, and I'm partially posting on here just so I'm sure I can find it again if I need some ideas for what to listen to.  My list isn't as long as others' but I'm being pretty...|||Another point: INFP types are known as the Idealists and I have heard a theory of procrastination which says that it comes from a person setting such high standards in their mind (an ideal, perhaps...|||Well, this isn't me at all, but then again I have a bit of impulse control so if I'm not feeling calm no one else is going to feel calm because of me.  As for cute I don't think you can stereotype...|||I think Eleanor Roosevelt may have been an INFP.  If you google it, they have her classified as an ENFP but if you read a biography of her it actually seems like she was an introvert forced by her...|||Don't know much about subtypes, and ... WOW.  Definitely the Teacher.  First time I read it through I thought, yeah, in some ways.  Reading more carefully a second time, it is me almost perfectly. ...|||[/LIST]  Interests and hobbies: I generally like to read a lot (I'll tell you more about what later), though sometimes work gets too busy.  I also enjoy writing but it comes in bursts and goes...|||Well, I can't help with the is he/isn't he gay thing at all, sorry.  However, I can commiserate with the part about waiting for someone to text back, and feeling like they have this power over your...|||Oh, wow, I am totally in that situation right now where I'm being treated very poorly, only I have the opposite problem as you, which is that I can't seem to find the courage to stand my ground.  Do...|||I don't think I cry too much but my mom thinks so.  I'm pretty sure she thinks I'm clinically depressed because of it, even though I'm not.  I mean, I'm pretty sure I'm not.  I cry for a bit,...|||Lol, well I feel dumb.  But it works, see?  Thanks!|||Alcohol doesn't actually change your base personality.  If it were as easy to change who you are as that, MBTI wouldn't be very valid.  Alcohol just makes you say or do things that you would...|||So I was absent from the site for a couple months, and since I've been back a couple weeks ago whenever I try to create a thread (like right now) or reply to a thread, I am unable to create a new...|||Also, sorry for the huge long single paragraph.  For some reason, the window here won't let me create new paragraphs.  Attempting to fix that now.|||Eggsies, thanks for the reply.  Your perspective on the cheating thing is interesting, I never really thought about it that way, especially not at the beginning but perhaps you make a good point...|||In the INFP forums we once had a conversation about what we like getting for gifts and we agreed on a lot of things.  However, I'm a terrible gift giver for anyone with different tastes.  So, I'm...|||I was always very, very good at math, but I never *enjoyed* math.  To be fair, I'm only slightly more F than T (as opposed to the other functions).  Also, I have to say while math is very methodical,...|||Ok Mr. ENFJ, I have a conundrum for you.  I am dating an ENFJ, have been since about January, but we both have very busy schedules and have been able to spend very little time with each other (being...|||I love bikes but use one for recreation, not actual transportation.  I might bike on weekend or evening errands when the weather's nice except right now I live up a steep hill that I'd never make it...|||I haven't been clinically diagnosed with ADHD, but after reading extensively and talking with my mom about my behaviors as a kid (and found out she wanted to take me to a psychologist but my dad...|||My yoga clothes: tight black capris and a pink and purple tank.|||I tear up at movies sometimes, but I don't generally cry hard.  Exceptions are if it's the movie version of a book I read (like Harry Potter).  I believe this is because two hours is not usually...|||Unfortunately, I kind of read a lot of books at once.  For fiction, I'm working on The Night Circus by Erin Morgenstern and am almost done with The Dovekeepers by Alice Hoffman.  Also reading a...|||I'm a little ambivalent about books being made into movies.  Many of my favorite books are literary enough that a movie version would be a atrocious.  A couple I agree with:  1. Finish His Dark...|||I could not read this point without replying.  You may be physically alone, but someone's hearing you!  I haven't posted on this thread before, but I fear it may be where I belong ...|||Out of curiosity, if you had someone who desperately wanted to meet your needs but didn't know how, what would you tell this person?  Would you even know what to ask them for?  Or is this more of...|||Well I've never read that book but I have seen the loosely-based movie, and I see what you're saying.  I have thought of that, too, but I'm just not fully convinced that this is the case, and I'm not...|||I greatly appreciate your input.  What you and boxerkitty have said about an ENFJs need to socialize with a wide set of people and to have time to unwind do make me feel somewhat better about the...|||My one thing that I would love to have in the person I choose to spend my life with (assuming that I do find someone with whom I choose to spend my life), is similar to a point you made.  I have...|||Completely agreed, MadRabbit.  Once exception: if I'm pursuing an answer that I will never find, that possibly doesn't exist.  I go through cycles where I get frustrated, give up and decide to stop...|||Yeah, I hear you.  I know it's not really as complicated as I wish it were, but it seems that way in my mind.  One, I don't entirely know how to bring it up without using the word marriage which...|||I don't know for sure that he is an ENFJ but it seems by far the most likely, so I thought I'd post here for some advice.  ENFJs, what are some of the difficulties you have with relationships?  If...|||This is something that has been bugging me for a few weeks now, and I thought I would post it on here where other people seem to get me and think about things in the same way.  So, I'm seeing...|||But why?  If your original post title is anything to go by, I can totally relate.  I almost posted a similar thread -- about not being able to trust in relationships -- a few days ago.  If you...|||I have no desire to control others, but I do kind of freak out when I feel like I have no control over my feelings in a situation.  Let me explain.  I have no desire to tell someone else what to do...|||As others have mentioned, I feel really guilty when I spend a lot of money on spa-type things.  I just feel like I could be putting it somewhere more useful especially since I don't make a ton of...|||Sad, angry, pathetic, embarrassed, love|||Oh, definitely, definitely.  This stems from a combination of a number of things that have occurred in my life, but the biggest overall factor is that I form attachments incredibly easy.  Seems a...|||I'm really hoping that since you referred to a break-up letter that this is a long-distance relationship.  Because if not, seriously?  You can't even face this person to tell them how you feel? ...|||I can't honestly see the point in saying which letter I'd like to change because I can't imagine being anyone but who I am.  That being said, I voted INTP because I'm closer to T than I am to E, S,...|||Ok, a few things, sort of issues I had with the test.  1. I took the quiz and got 147 - The Entertainer.  One, I don't think this is really my type, for reasons I'll describe below, and two,...|||Yeah, I definitely get jealous when it comes to romantic relationships.  To be honest, I haven't had many serious romantic relationships, and this is part of the reason (though certainly there are...|||Wait, leafstone, third volume of 1Q84?  Was the book originally split in Japanese (or another language)?  I spent an entire week at the beach with that book and didn't finish (I have finished since...'"
