type,posts
INTJ,"'I tend to build up a collection of things on my desktop that i use frequently and then move them into a folder called  'Everything' from there it get sorted into type and sub type|||i ike to collect odd objects, even at work...a lot of people would call it junk but i like to collect it.  Old unused software? ill take that off your hands :) i have a bunch of old adobe...|||i think its quite normal, i tend to only see my friends in real life every couple of months, as said earlier some people just dont get it but the good ones do :)  Edit: i mostly mean tolerate it...|||where do we go when we sleep? is dreaming another form of being awake? how many more layers of this are there if any?   thoughts about sleep keep me up at night  Edit: sometimes im too scared...|||thanks|||i wish i was free to follow my interests as i desired  i feel as though wishes are meant for impossible things|||by seeing do you mean visual interpreting or seeing as in mentally understanding the concept?|||hello|||i feel as though i am incapable of creating anything   and i wish i could|||i cant stand the interviewer christ that laugh...  is he intj? hmmm  it would be interesting to see an intj on this show, i doubt they would be that interesting to the general public though ...|||know yourself and be yourself|||Do you think Fi or Fe sounds more like me?  which one do you think sounds like you?  Why do you require input from others to know what you are?|||Question: do INTJs lean more towards Alternative Rock then other types of music? And if so, why?   My Answer: well, if you went through all the pages and then sorted all the songs by genre/style...|||sometimes i look at people and i see them , well on the outside at least, doing all these things and saying all these words and i wonder what it would be like to act that way... am i missing out on...|||a lounge huh? what does one do in a lounge?  or is it best not to define it and just enjoy it as is?|||Do it|||went on holiday for just over a month, thought things would change. How naive of me..  feels nice to browse back on this forum here though, its been a while since i surrounded myself with somewhat...|||yes i would say i am, more than physical appearance to an certain degree.  what are they? i am unsure they just generally cant be a terrible person by my standards|||i like to lurk, in my case at least its mostly because i tend to believe i have nothing interesting to contribute to the conversation so why add anything?  logging out to purposely lurk seems like...|||i think id wait for him to swing first before taking further action but i would not  encourage them to take a swing  a part of me wants to fight him though...|||would you say there is complexity in simplicity?|||I normally vote for whoever amuses me the most..  perhaps one day i'll care more  Edit: other than what amuses me at the time, ill vote for whatever would apparently benefit me the most....|||long distance is hard|||INTJ's and what effects their sanity levels  Mental illness|||So i think about which thoughts i wish to express in written format, then i proceed to perform the physical movements necessary to express the required thoughts in whichever medium is required or...|||651762 i got this, seems right to me. I always score intj, extra heavy on the introversion :3|||I like this  https://www.youtube.com/watch?v=e4dT8FJ2GE0  I like the sound, the content/lyrics are not too important, the sound is what i value most. Is it my favourite? probably not, i heard...|||to others maybe, although internally i am acutely aware of any mistakes i have made|||assuming they would listen to me, i would each give them a solo task that leads to the successful completion of the project  how would i make them listen to me? explain that the success of the...|||i am a fan of the idea that a celestial being died and its essence became everything we know, what kind of sacrifice would have to be made to create such wondrous things? (stars, planets, cosmic...|||Nah|||1) Since when do you need a manager present to make returns?? or was it because I work there? - check the company policy on this 2) Why did they want to save my receipt? -not sure, perhaps to...|||i remember my first encounter with this type of music was BOA - Hurricane Venus, saw it played on a starcraft 2 stream round 201011 or something and was kinda hooked. Don't follow/watch it much...|||what happens when this riddle gets solved? what use is this information?   haha i am clearly not a fan of riddles  Edit thoughts: Girlfriend asked me a few riddles and it was infuriating for...|||i kept pressing them to talk about something they didnt want to, i regret it deeply|||It is not hands that summon us. It is desire.  I want nothing to do with that puzzle box. Nope. Nope. Nope|||i used to think life was dull and everything was boring, then i realised that i havent actually done everything so it felt incorrect in thinking that way|||ahh yes the pain of living, its beautiful isnt it?|||i got   Your score for openness was 70%. This is in the moderate range. Your score for conscientiousness was low, at 35%. Your score for Extraversion was low, at 15%. Your score for...|||What do you mean by humanities? i like to think about the direction of the human race as a species and i like to appreciate where weve come from so i guess i love humanities?|||1. Attempt to think less about things 2. Be more decisive and confident in my decisions/thoughts (i cant help but play devils advocate with myself, i guess this ties into number 1) 3. change my...|||Ahh yes that sinking feeling when something goes incredibly wrong or not to plan. How do i get over it? embrace the madness, how are you going to deal with your scenario now with all these new...|||I like to imagine it kinda like this 629346  except the ring is a billion times higher and nearly impossible to scale and then in the middle is a beautiful garden and house where i like to chill....|||if you look at the first sentence of most of them you can gather the feeling they are trying to portray, followed by a rather nice scenario.  So yes i do feel those feels, but not for those...|||I think its the introversion crossed with the feels that does it for me.|||first encountered mbti?  hmm was a personality test i took in highschool, didnt care or even pay attention to it until later. stumbled upon it somehow and was interested  Im not too into it as...|||Treat Yo Self|||Question: Can INTJs be try-hards?  Answer: sure|||No im not, our values of friendship are clearly different. An emotional investment of any kind is a big deal to me, a HUGE deal, to have it not appreciated and/or reciprocated is soul destroying. ...|||petty? perhaps, but why bother with someone who isnt going to give me what i want when i can just move on? what a waste of my time and emotional energy.  Hopefully for you this friend of yours is...'"
INFJ,"I'm not sure, that's a good question. The distinction between the two is so dependant on perception. To quote Robb Flynn, ''The hate you feel is nothing more, than love you feel to win this war.''|||Good question! It's tough to say for sure but I loved Winona Ryder as Lydia in Beetlejuice...  http://i63.photobucket.com/albums/h158/trinsghost/Misc-Images/2921aa070866f20450f8e1160b1e5d41.jpg|||https://www.youtube.com/watch?v=r5If816MhoU|||https://www.youtube.com/watch?v=Q-sQklvpDhA|||I've been lonely for much of my time. For a while now I've been working on changing ''how to think'', and one way is trying to find the positive in everything, no matter how bleak it might seem. I...|||I hope I can look back at this current stretch of time and think, ''Thank God I'm not there anymore and things are so much better''. What an ass-kickin' I'm taking.|||Help or a voice of reason, other than my own distorted, in my life. I'm completely frusterated and feel like I'm on the brink. I'm carrying the weight of everything negative I've ever had in my life...|||Think I posted this before but I'm still feelin' it....   https://www.youtube.com/watch?v=Cu8qsC1WLiE|||Fleeting thoughts of acknowledging and getting lost in the depth love that we share for one another. It could be the most mundane thing but every now and the simplest act will make me appreciate the...|||https://www.youtube.com/watch?v=pULe7-6yRo4|||I've been told that I'm OCD and I'm aware of it. For me it's more than just obsessive cleaning and things of that nature. I've come to understand how it affects things such as obsessing on a thought...|||https://www.youtube.com/watch?v=XkbQDChgmX8|||I'm working on a song I've been trying to learn for just about a year. Was hoping to finish it before the New Year but still have a ways to go.|||Sons of Anarchy is the first TV series I've followed since The X-Files WAY back in the day.|||https://www.youtube.com/watch?v=2R2NrV4ve1o|||Fleeting|||I'm not a big book person but every now and then I go through stages and force myself to read more than I normally do. One book that always stands out in terms of interest while reading was ''Venus...|||https://www.youtube.com/watch?v=9utPTpXpIgE|||Frustration got the best of me today, and has been a lot lately. Having a couple Heinekens right now and feel a bit better. :) This is a difficult time, and is going to be for a bit, gotta maintain.|||Find balance, get more in harmony with life and position myself to capitalize on any opportunity that presents itself. Within that lies the path to a more fulfilled life, at least I'm hoping. ;)|||https://www.youtube.com/watch?v=RoL0nRuHj0I|||I'm not a touchy-feely person and don't care for folks I don't know feeling up on me. My response depends greatly on the person doing it. Some people are just naturally affectionate and it's their...|||https://www.youtube.com/watch?v=oYZh9yQu1fo|||https://www.youtube.com/watch?v=d5abdXpvBR0  ...Very frusterated, wrestling with thought, and not winning.|||Escape From Alcatraz|||https://www.youtube.com/watch?v=u8lOTMMRJZg|||https://www.youtube.com/watch?v=-ls5mug1_KU|||I'm grateful to still have a little time to make good of all the things I've learned the hard way through countless mistakes and wrong turns.|||https://www.youtube.com/watch?v=ff_6BF37fI0|||A great song to start the day...   https://www.youtube.com/watch?v=YnHaYVYFTU8|||Joints hurt a little, other than that I feel the same old usual indifference. :P|||An early 90's style Ford Mustang GT with the more square body. In all reality, one can be found for a few thousand dollars which makes this dream car very attainable. :)|||http://www.youtube.com/watch?v=Cu8qsC1WLiE|||It was kind of intended to have a dark, terrible to feel about it. Depression has many depths, and those levels vary from person to person. I've dealt with serious depression my whole life and it...|||http://www.youtube.com/watch?v=QnRkiAK_gZc|||http://www.youtube.com/watch?v=66Vc-2CS4ew|||Comfort food - Pizza and chicken wings, cheesecake or pumpkin pie  Comfort drink - Redbull, Guinness or Red Wine|||Still grinding out this song on guitar, it's coming along but slowly and most certainly not easily.|||Some vague advice I can give is this, it can always be worse and in most cases it probably will be someday. So it works to look at any current situation like this, it helps to appreciate what you...|||Content, not happy but more content than I've been in a while, a LONG f'n while. I'll take it.|||For breakfast I had a piece of grilled chicken and a Guinness.|||-Seven -The Decent -Rocky -Heat -Silence of the Lambs|||http://www.youtube.com/watch?v=gvYm6kVY2IE|||Robb Flynn of Machine Head, Michael Amott of Arch Enemy, Jerry Cantrell of AIC.  Edit: Forgot to include Zakk Wylde, a musical genius.|||Pucca...That shirt could be a lot of fun indeed. :)|||....Watching a video of Megadeth live on the Big Four Tour.|||http://www.youtube.com/watch?v=2XhGQisD040|||JungleDisco...Takin' it back with Silk. Great Stuff.   http://www.youtube.com/watch?v=9uhLDWCqSQQ|||Rockin' some Down right now.....   http://www.youtube.com/watch?v=aKfmYGlhWWk|||....I currently desire for July 20th to roll around so I can finally see Machine Head live at this years Mayhem Festival. F**k yeah.    http://www.youtube.com/watch?v=lK588zl0l2M"
ESTP,"'I don't class this as lying. I do this all the time just to mess around...  I'm brutally honest about my opinions, like my sister got part of the side of her hair buzzed and part coloured blue, and...|||It depends on what I'm doing. If it's a piece of IKEA furniture, then I'll have a vague look at the instructions to make sure I've got the right idea before diving in. If it's something like an alarm...|||1. Is eye contact comfortable for you in general? Yeah, unless the other person has a lazy eye... Then I'm never really sure which one to look at...  2. What would make you avoid eye contact with...|||I'm either really organised, or I don't care. Like my bedroom was a complete mess for 6 months because I just couldn't be bothered, then a switch just flicked in my head, and now it's near perfect...|||If I was walking then I'd probably chose the right side because it's the right choice... If I were driving, then the left, because I live in the UK we drive on the left side of the road and it would...|||1. Check... pain tollerance is high too... I went 4 years with a cavity in one of my teeth before I finally got around to getting it sorted... Never actually broken any bones though, I swear I was...|||1.Abortion No real strong opinion, should be up to the mother ultimately though.  2.Gay Rights Support gay marriage, etc. But I also support the churches choice to not allow the marriage on their...|||I never really used to have any dreams at all that I remembered even having, but over the past few years I've started having then. They're never abstract, other than real life actors taking the place...|||I did something similar to this back when I was in school. I was in the middle tier english group, it was boring, me and a couple other kids would just throw dictionaries at each other for the entire...|||I generally appreciate an absence of neurotocism. When people try too hard to get me to like them it puts me off... I just can't help thinking that they're being... fake, although they're probably...|||When I had a car I sped a lot. Crashed it a few months ago, got out and after the cleanup got in a friends car and he sped us home :). Don't have a car now though because I moved right into the city...|||I've known all my life that I'm the antidote to communism. Isn't capitalism just the best? Or atleast, better than every other system. It takes account of human nature in a way that communism never...|||I shower every day.. If I don't, then I can smell my BO and just feel my hair being greasy and I feel revolting.. unless I'm not going outside that day, then I don't care so much|||You pretty much stole all the common ones... Don't forget you can add f*cking to the front of those adjectives for added benefit.  e.g. This cheesecake is F*CKING AWESOME.|||I've been away for a couple of weeks because I started a new job last week. Pretty hectic.|||BBC NEWS | UK | England | Manchester | Police defend drowning death case God that's an old news story now.... actually happened before I started university.  Slightly scared of posting due to the...|||England is full of the Police Community Support Officers now, who are mostly powerless useless tools. There was a news story about how 2 of them let a child drown in a lake because they decided it...|||I'm in the UK, next to no-one has guns, and those that do practically never use them because of how much heat they'd get. Everyone always seems complacent to rationalise ignoring events like that...|||I agree with most of the above, if there's one I'm going to add though it's probably cowards. Yesterday me and my house mates were driving home from the cinema, and one of my housemates saw 2 guys...|||Dude, I dunno if you'll have them wherever you're at, but in the UK we have these mini cheeses called Baby Bells. They're coated in this wax which is perfect for rolling into miniature balls to throw...|||*fixed    Aw man I have to type at least 10 characters.. how can this be a short and punchy message now...|||So in conclusion,  making babies = fun. Maintaining babies = lame  Agreed. This certainly advertises the fun: Babies - Weebl's Stuff|||That's just mean. You're meant to point and laugh at people whilst they're not looking. That way, they can be ridiculed and humiliated from the comfort of behind their back.  It's a pretty brutal...|||wait that's a dog?  ^^possibly the reasoning behind the stereotyping|||Well my A-Level teacher wrote in my report card that at times I was capable of mathematical genius, which was often hampered by a lack of working and laziness. If she'd just told me I was crap at...|||my moves were spread out and halved between both of them..... did I mention that I was also sober?!?|||lol I never wrote out my working for maths in lessons. My teacher would always tell me off for not writing out the working, but then spoil her argument by telling me she was impressed that I managed...|||You know, I made this video recently to test out some video editing software. Completely forgot about this thread when I made it...   http://www.youtube.com/watch?v=yt7WtwGDfRc|||I got the marks back from my last 24 hour high on caffeine drinks report the other day, 78%, which is a first (the highest grade in the UK). 32 pages!|||I don't perceive myself as fitting in with society, I just don't care so my self-esteem is always at or near 100%. It almost certainly shouldn't be, but meh? If someone dislikes me, that's their...|||That looks like a Czech Republican I used to work with... No idea if he was ESTP or not though, he was fun though so it's possible ;)|||I am staying UP all night. Pesky coursework >_<. I'm going to colour my hair whilst everyone else is asleep though to confuse THE F*****G F**K out of everyone when they wake up.  Also, I acquired...|||Nothing else coming in to replace them right?|||I actually said this, and when I get ill, I stop being ill and be awesome instead years ago before HIMYM. Stinson stole my quotes :'(|||I think if you combine all of those tables you might possibly have every MBTI combined with every enneagram  Edit: I just took the PerC Enneagram test... 3w2.. guess it's not that odd since I...|||I sway between 4-5 and 12 hours depending on how much stuff I have going on, like right now I'm down to about 5 since my thesis is due in next week and I've barely started...|||That video was amazing. I will have to concede that I am currently stupider than every Swede :(|||Time to play devils advocate:   The grammar of the quote suggests that she left Europe when she was already inside Italy, and since the Vatican & San Marino are inside Italy, and outside of the...|||So he didn't actually mention bad breath? Is it possible that either someone was at the other table farting, or that he was jokingly referring to what you were saying (poor joke, but meh)? If I'm in...|||I'm fairly certain that in my case it's because of the high use of the word awesome to describe pretty much everything about myself, my life, or things which I like which other people would simply...|||When I've been pulled over previously, I didn't give any excuses. I just talked to the police officers in their car for about 15 minutes about where I was going, and just my general life situation,...|||Accidents are a surprisingly good way of getting women's phone numbers...|||So far I've had 0 fines. I've been pulled over twice for speeding (both ~70mph in a 50 zone, not too bad) but I talked my way out of it both times. I did get caught by a mobile camera at the start of...|||Clearly... did you see the other threads? They all have gyroscopes and levers going on... My suggestion was pretty much to get a new cylinder.|||I would say internally, put most of the weight at the bottom so it acts like a weeble, or a loaded dice.|||I personally don't think I've ever felt stressed in my life, if I ever find myself in a stressful situation I just get a big grin on my face. I love having the odds stacked against me, that's when...|||I don't make long term decisions, I do things and see how they turn out. Before university, I had no intention of starting a relationship, but then I stumbled into a long term relationship (which...|||Me and my ex went long distance in the last 6 months of our relationship, only saw each other once every 2 weeks. Simultaneously the most awesome, and worst thing ever.|||TL:DR I don't like reading, but I like talking. I had a pet but it died.|||I find it difficult to convey any deep states or emotions. I have 3 which I'm comfortable telling people about: awesome, normal and pissed. I'm sure others exist from time to time, but no-one ever...'"
